id,title,description,image_prompt,tags,categories,price,player_count_min,player_count_max,play_time_minutes,publisher,designer,release_year,image_url,created_at,updated_at,description_vector
757,"Inis: Silos","Built around Thematic systems, Inis: Silos pushes Engine Building choices across 9 linked sessions and rewards tables that enjoy merchant drama. Mission cadence alternates between tactical crunch and narrative resolution, preventing decision fatigue while preserving competitive tension. Campaign logs track table history, so failed gambits still unlock content; expect up to 6 relic-style upgrades that alter scoring priorities. The late game stays dramatic without becoming random, making each finale feel like the natural consequence of earlier risks.",,"Cards|Engine Building",Thematic,31.08,4,6,43,"Clockwork Labs","Akira Flynn",1996,/images/fixtures/game_0757.png,2025-11-11T05:43:29+00:00,2026-03-26T10:29:41+00:00,"0.1773,0.8143,0.0485,0.1968,-0.423,-0.8724,0.4188,-0.2199"
758,"Crowned Crown","Crowned Crown opens like a classic Party game, then quickly reveals Campaign layers that reward long-form table memory. Its Party framework encourages risky pivots, especially once table politics reshape priorities. By mid-campaign, 5 relic slots and rotating objectives create dense interaction where denial play is as valuable as raw points. Because scoring vectors drift over time, tables that over-specialize early often get punished once Campaign effects begin stacking. If your group values depth with momentum, this one delivers a rare mix of sharp tactical play and evolving campaign texture.",,Solo|Campaign,Party,39.81,1,8,138,"Arcana Works","Elliot Mercer",2007,/images/fixtures/game_0758.png,2025-12-08T08:13:37+00:00,2026-03-26T10:29:41+00:00,"-0.5389,0.5823,-0.6282,0.948,-0.9243,0.4383,-0.7558,-0.8416"
759,"Zoo Vadis: Labyrinth","Zoo Vadis: Labyrinth frames guild conspiracies as a living sandbox: each scenario escalates pressure while 1–3 players teams improvise around shifting incentives. Its Eurogame framework encourages risky pivots, especially once table politics reshape priorities. By mid-campaign, 3 relic slots and rotating objectives create dense interaction where denial play is as valuable as raw points. Rule overhead stays modest thanks to consistent icon grammar, even while strategic depth rises sharply after the first two plays. Win or lose, Zoo Vadis: Labyrinth tends to produce table stories that reference specific gambits and betrayals for weeks afterward.",,"Miniatures|Campaign|Tile Laying|Legacy",Eurogame,55.29,3,5,174,"Indigo Forge","Soraya Kline",1992,/images/fixtures/game_0759.png,2026-01-08T06:00:00+00:00,2026-03-26T10:29:41+00:00,"-0.4385,-0.268,-0.396,0.6817,-0.395,-0.0707,-0.0058,0.4238"
760,"Azul: Silos","Built around Thematic systems, Azul: Silos pushes Legacy choices across 13 linked sessions and rewards tables that enjoy arcane rivalry. Map states remain highly legible despite scale; by late game, up to 13 tiles and layered markers support deep positional planning. Veteran groups report that Azul: Silos shines brightest after a few sessions, once subtle timing windows and bluff cues become legible.",,Cards|Legacy,Thematic,63.22,1,8,175,"Arcana Works","Marcus Thorne",1994,/images/fixtures/game_0760.png,2025-05-10T05:44:47+00:00,2026-03-26T10:29:41+00:00,"0.423,0.8662,0.4021,-0.9339,0.7624,-0.2016,-0.0423,-0.9552"
761,"Monolith under Legacy","Monolith under Legacy frames mythic restoration as a living sandbox: each scenario escalates pressure while 1–7 players teams improvise around shifting incentives. Map states remain highly legible despite scale; by late game, up to 30 tiles and layered markers support deep positional planning. Only adaptable crews master Monolith under Legacy, where legacy stickers permanently buff underused strategies and long-term planning matter as much as tactical brilliance.",,Campaign|Cards,Co-op,81.89,2,9,63,"Silver Oak Studio","Marcus Thorne",1990,/images/fixtures/game_0761.png,2025-09-23T18:55:50+00:00,2026-03-26T10:29:41+00:00,"-0.6417,-0.2116,-0.4994,0.8184,-0.6795,-0.3382,0.3913,0.1818"
762,"Heat: Scout","Heat: Scout opens like a classic Abstract game, then quickly reveals Solo layers that reward long-form table memory. Its Abstract framework encourages risky pivots, especially once table politics reshape priorities. Round structure forces meaningful tradeoffs between tempo and efficiency; over 4 chapters, even small resource leaks become strategic liabilities. Component design supports readability at scale: icon-first cards, layered reference boards, and phase reminders keep late-game turns moving. The late game stays dramatic without becoming random, making each finale feel like the natural consequence of earlier risks.",,Solo|Dice|Campaign,Abstract,87.51,3,7,145,"Arcana Works","Elliot Mercer",2009,/images/fixtures/game_0762.png,2025-12-12T12:07:04+00:00,2026-03-26T10:29:41+00:00,"-0.4713,0.0128,0.7467,-0.6248,0.4219,-0.6319,0.1731,0.6952"
763,"My City Arcane","My City Arcane opens like a classic Party game, then quickly reveals Campaign layers that reward long-form table memory. Economy rails are intentionally unstable: once players trigger threshold events, 7 new scoring hooks reshape optimal lines. If your group values depth with momentum, this one delivers a rare mix of sharp tactical play and evolving campaign texture.",,"Tile Laying|Campaign",Party,59.94,4,7,114,"Arcana Works","Nico Valdez",2011,/images/fixtures/game_0763.png,2025-03-31T02:08:25+00:00,2026-03-26T10:29:41+00:00,"-0.3837,-0.1332,0.7847,0.1332,0.2704,0.5378,0.0459,-0.6987"
764,"Island beyond Peacocks","Island beyond Peacocks blends Family structure with Solo chaos, delivering 110-minute arcs where every decision compounds into later chapters. Component design supports readability at scale: icon-first cards, layered reference boards, and phase reminders keep late-game turns moving. Map states remain highly legible despite scale; by late game, up to 22 tiles and layered markers support deep positional planning. If your table likes post-game debriefs, Island beyond Peacocks will spark them—nearly every finale feels earned, messy, and memorable.",,"Solo|Miniatures|Tile Laying|Dice",Family,68.08,3,5,32,"Clockwork Labs","Elliot Mercer",1999,/images/fixtures/game_0764.png,2026-01-23T13:33:06+00:00,2026-03-26T10:29:41+00:00,"-0.5873,-0.0444,0.6067,-0.9673,-0.2008,-0.7103,-0.4029,-0.274"
765,"Forge beyond Guild","Forge beyond Guild blends Party structure with Tile Laying chaos, delivering 62-minute arcs where every decision compounds into later chapters. Its Party framework encourages risky pivots, especially once table politics reshape priorities. Round structure forces meaningful tradeoffs between tempo and efficiency; over 5 chapters, even small resource leaks become strategic liabilities. Scenario goals favor adaptive teams: one mission asks for diplomatic efficiency, the next demands aggressive engine conversion under time pressure. If your table likes post-game debriefs, Forge beyond Guild will spark them—nearly every finale feels earned, messy, and memorable.",,"Campaign|Tile Laying|Solo",Party,47.47,4,9,52,"Nimbus Games","Akira Flynn",2020,/images/fixtures/game_0765.png,2026-01-12T22:30:39+00:00,2026-03-26T10:29:41+00:00,"0.0756,0.6344,-0.2206,-0.7584,-0.1553,-0.9236,-0.3775,-0.4667"
766,"Inis Drafting","Inis Drafting frames arcane rivalry as a living sandbox: each scenario escalates pressure while 2–5 players teams improvise around shifting incentives. Its Co-op framework encourages risky pivots, especially once table politics reshape priorities. Economy rails are intentionally unstable: once players trigger threshold events, 8 new scoring hooks reshape optimal lines. Because scoring vectors drift over time, tables that over-specialize early often get punished once Miniatures effects begin stacking. Only adaptable crews master Inis Drafting, where players vote to rewrite one core rule each chapter and long-term planning matter as much as tactical brilliance.",,"Miniatures|Tile Laying",Co-op,57.76,3,7,64,"Nimbus Games","Akira Flynn",2007,/images/fixtures/game_0766.png,2026-02-10T18:18:52+00:00,2026-03-26T10:29:41+00:00,"0.2907,0.5059,0.7995,0.082,0.695,0.7698,-0.993,0.4163"
767,"Sanctum against Chronicles","At its core, Sanctum against Chronicles is a Deck Building design where Solo, Dice and Engine Building mechanisms collide with initiative bidding pacing for 1–8 players groups. Its Deck Building framework encourages risky pivots, especially once table politics reshape priorities. By mid-campaign, 8 relic slots and rotating objectives create dense interaction where denial play is as valuable as raw points. A standout mechanic tied to Solo means even safe plans can collapse if opponents read your tempo one round ahead. Expect repeat plays to diverge quickly: opening lines may look familiar, but midgame states rarely resolve the same way twice.",,"Solo|Dice|Engine Building","Deck Building",80.63,1,6,88,"Indigo Forge","Soraya Kline",2023,/images/fixtures/game_0767.png,2025-10-14T23:05:51+00:00,2026-03-26T10:29:41+00:00,"-0.84,-0.643,0.3496,-0.3873,-0.3552,0.6833,-0.9223,0.3755"
768,"Zoo Vadis Competitive","Zoo Vadis Competitive frames frontier diplomacy as a living sandbox: each scenario escalates pressure while 2–6 players teams improvise around shifting incentives. Its Family framework encourages risky pivots, especially once table politics reshape priorities. Campaign logs track table history, so failed gambits still unlock content; expect up to 3 relic-style upgrades that alter scoring priorities. Hidden information is sparse but impactful, creating tense reveals that reward inference rather than guesswork. Only adaptable crews master Zoo Vadis Competitive, where weather tracks alter core action costs between rounds and long-term planning matter as much as tactical brilliance.",,"Engine Building|Cards",Family,26.33,4,9,155,"Nimbus Games","Lena Ortiz",1998,/images/fixtures/game_0768.png,2025-08-01T02:50:46+00:00,2026-03-26T10:29:41+00:00,"0.9373,0.731,-0.8213,0.6467,-0.8564,0.9177,0.2747,-0.5368"
769,"Tatari Epic","Tatari Epic opens like a classic Strategy game, then quickly reveals Cards layers that reward long-form table memory. Your group manages swingy economies while chasing milestone bonuses; by chapter 5 the board can contain over 16 modular tiles. Expect repeat plays to diverge quickly: opening lines may look familiar, but midgame states rarely resolve the same way twice.",,Miniatures|Cards,Strategy,77.81,2,9,153,"Arcana Works","Akira Flynn",2018,/images/fixtures/game_0769.png,2025-11-17T16:38:51+00:00,2026-03-26T10:29:41+00:00,"0.3592,0.885,0.8427,-0.8555,-0.2606,-0.4498,0.2752,0.7029"
770,"Trails against Forge","Trails against Forge frames guild conspiracies as a living sandbox: each scenario escalates pressure while 2–4 players teams improvise around shifting incentives. Scenario goals favor adaptive teams: one mission asks for diplomatic efficiency, the next demands aggressive engine conversion under time pressure. Core turns revolve around real-time bursts: commit actions, resolve conflicts, then pivot as event decks introduce 5 escalating complications. If your table likes post-game debriefs, Trails against Forge will spark them—nearly every finale feels earned, messy, and memorable.",,"Cards|Solo|Tile Laying","Deck Building",48.95,2,7,92,"Indigo Forge","Elliot Mercer",2001,/images/fixtures/game_0770.png,2025-05-13T03:04:08+00:00,2026-03-26T10:29:41+00:00,"0.6021,-0.5854,-0.6221,-0.7214,-0.3942,-0.8507,0.0767,-0.6568"
771,"Voyage under Alliance","Voyage under Alliance blends Abstract structure with Legacy chaos, delivering 162-minute arcs where every decision compounds into later chapters. Core turns revolve around simultaneous planning: commit actions, resolve conflicts, then pivot as event decks introduce 9 escalating complications. If your group values depth with momentum, this one delivers a rare mix of sharp tactical play and evolving campaign texture.",,"Legacy|Tile Laying|Solo",Abstract,73.14,2,9,60,"Arcana Works","Elliot Mercer",1995,/images/fixtures/game_0771.png,2025-09-21T11:28:38+00:00,2026-03-26T10:29:41+00:00,"0.6036,0.8267,0.3162,-0.7981,-0.1508,-0.9669,-0.2546,0.2018"
772,"Championship of Caravan","Built around Party systems, Championship of Caravan pushes Legacy choices across 7 linked sessions and rewards tables that enjoy expedition survival. Its Party framework encourages risky pivots, especially once table politics reshape priorities. Action windows stay short, but consequence chains run long, especially in sessions around 103 minutes where adaptation beats scripted play. Scenario goals favor adaptive teams: one mission asks for diplomatic efficiency, the next demands aggressive engine conversion under time pressure. Win or lose, Championship of Caravan tends to produce table stories that reference specific gambits and betrayals for weeks afterward.",,"Legacy|Engine Building|Solo|Campaign",Party,25.69,3,5,164,"Silver Oak Studio","Marcus Thorne",2022,/images/fixtures/game_0772.png,2025-08-12T23:37:06+00:00,2026-03-26T10:29:41+00:00,"-0.2649,0.5346,-0.8861,-0.1941,-0.6229,0.5947,0.9037,-0.4345"
773,"Cosmic Azul","Cosmic Azul frames political intrigue as a living sandbox: each scenario escalates pressure while 2–8 players teams improvise around shifting incentives. Scenario goals favor adaptive teams: one mission asks for diplomatic efficiency, the next demands aggressive engine conversion under time pressure. Round structure forces meaningful tradeoffs between tempo and efficiency; over 6 chapters, even small resource leaks become strategic liabilities. Few designs blend Abstract and Miniatures this smoothly while remaining approachable across varied player counts.",,"Miniatures|Solo|Tile Laying",Abstract,55.82,1,9,120,"Indigo Forge","Marcus Thorne",2002,/images/fixtures/game_0773.png,2025-09-30T10:56:12+00:00,2026-03-26T10:29:41+00:00,"-0.7292,0.5556,-0.2744,-0.6024,-0.3895,-0.8606,-0.6492,-0.2875"
774,"Ichor Stressful","At its core, Ichor Stressful is a Co-op design where Legacy, Cards and Tile Laying mechanisms collide with draft-and-resolve rounds pacing for 1–7 players groups. By mid-campaign, 6 relic slots and rotating objectives create dense interaction where denial play is as valuable as raw points. The late game stays dramatic without becoming random, making each finale feel like the natural consequence of earlier risks.",,"Legacy|Cards|Tile Laying",Co-op,62.14,1,6,30,"Arcana Works","Elliot Mercer",2012,/images/fixtures/game_0774.png,2025-11-07T09:13:15+00:00,2026-03-26T10:29:41+00:00,"0.3191,0.1338,-0.3895,-0.886,0.928,0.7661,-0.8192,-0.9627"
775,"Dominion against Bazaar","Part campaign and part systems puzzle, Dominion against Bazaar asks 1–6 players players to master Party priorities under swingy pressure. Its Party framework encourages risky pivots, especially once table politics reshape priorities. Action windows stay short, but consequence chains run long, especially in sessions around 76 minutes where adaptation beats scripted play. Negotiation matters more than it first appears; temporary coalitions routinely form, fracture, and reform inside a single chapter. Only adaptable crews master Dominion against Bazaar, where neutral factions can be bribed to swing regional control and long-term planning matter as much as tactical brilliance.",,Campaign|Legacy,Party,67.71,1,6,76,"Nimbus Games","Elliot Mercer",2001,/images/fixtures/game_0775.png,2025-09-14T05:16:06+00:00,2026-03-26T10:29:41+00:00,"0.7014,0.9318,-0.5334,-0.234,0.0831,-0.4026,0.5469,0.3311"
776,"Tatari Crowned","At its core, Tatari Crowned is a Thematic design where Solo, Cards, Miniatures and Legacy mechanisms collide with programmed actions pacing for 2–7 players groups. Round structure forces meaningful tradeoffs between tempo and efficiency; over 6 chapters, even small resource leaks become strategic liabilities. Expect repeat plays to diverge quickly: opening lines may look familiar, but midgame states rarely resolve the same way twice.",,Solo|Cards|Miniatures|Legacy,Thematic,42.30,4,7,99,"Nimbus Games","Nico Valdez",2004,/images/fixtures/game_0776.png,2025-04-12T05:43:52+00:00,2026-03-26T10:29:41+00:00,"0.7797,0.964,-0.5664,-0.1552,0.1784,0.8884,0.4503,0.7452"
777,"Alliance without Harvest","Alliance without Harvest blends Deck Building structure with Tile Laying chaos, delivering 180-minute arcs where every decision compounds into later chapters. Rule overhead stays modest thanks to consistent icon grammar, even while strategic depth rises sharply after the first two plays. Economy rails are intentionally unstable: once players trigger threshold events, 4 new scoring hooks reshape optimal lines. The late game stays dramatic without becoming random, making each finale feel like the natural consequence of earlier risks.",,"Miniatures|Tile Laying|Dice","Deck Building",81.81,3,8,129,"Arcana Works","Nico Valdez",2011,/images/fixtures/game_0777.png,2025-05-03T08:15:08+00:00,2026-03-26T10:29:41+00:00,"-0.4154,-0.5347,0.4306,0.0456,0.487,-0.3505,0.8635,0.0678"
778,"Legion without Loops","Part campaign and part systems puzzle, Legion without Loops asks 1–7 players players to master Family priorities under swingy pressure. Its Family framework encourages risky pivots, especially once table politics reshape priorities. Map states remain highly legible despite scale; by late game, up to 12 tiles and layered markers support deep positional planning. Mission cadence alternates between tactical crunch and narrative resolution, preventing decision fatigue while preserving competitive tension. The late game stays dramatic without becoming random, making each finale feel like the natural consequence of earlier risks.",,Legacy|Campaign|Cards,Family,44.38,2,8,130,"Nimbus Games","Lena Ortiz",1997,/images/fixtures/game_0778.png,2025-05-24T15:47:41+00:00,2026-03-26T10:29:41+00:00,"-0.5153,0.5266,0.7363,0.1365,-0.207,-0.7197,-0.102,0.7503"
779,"Horizon under Kingdom","At its core, Horizon under Kingdom is a Abstract design where Campaign, Dice and Solo mechanisms collide with simultaneous planning pacing for 2–5 players groups. Rule overhead stays modest thanks to consistent icon grammar, even while strategic depth rises sharply after the first two plays. Action windows stay short, but consequence chains run long, especially in sessions around 32 minutes where adaptation beats scripted play. Expect repeat plays to diverge quickly: opening lines may look familiar, but midgame states rarely resolve the same way twice.",,Campaign|Dice|Solo,Abstract,89.01,4,8,47,"Arcana Works","Marcus Thorne",1994,/images/fixtures/game_0779.png,2025-12-24T02:53:39+00:00,2026-03-26T10:29:41+00:00,"-0.0788,0.2264,-0.9416,0.1103,-0.6808,0.692,0.1619,-0.7747"
780,"Echoes without Nana","Echoes without Nana opens like a classic Party game, then quickly reveals Miniatures layers that reward long-form table memory. Its Party framework encourages risky pivots, especially once table politics reshape priorities. Core turns revolve around real-time bursts: commit actions, resolve conflicts, then pivot as event decks introduce 9 escalating complications. Hidden information is sparse but impactful, creating tense reveals that reward inference rather than guesswork. The late game stays dramatic without becoming random, making each finale feel like the natural consequence of earlier risks.",,"Miniatures|Campaign|Legacy|Tile Laying",Party,58.34,4,8,47,"Silver Oak Studio","Marcus Thorne",2008,/images/fixtures/game_0780.png,2025-05-09T18:30:49+00:00,2026-03-26T10:29:41+00:00,"0.0757,0.5979,0.1885,0.7029,-0.5927,-0.5637,-0.0639,-0.4676"
781,"Elegant Tatari","Elegant Tatari is a mid-weight hobby Party title for 1–4 players that leans into Solo and Legacy and sequential tactical turns play. Your group manages tight economies while chasing milestone bonuses; by chapter 5 the board can contain over 18 modular tiles. Veteran groups report that Elegant Tatari shines brightest after a few sessions, once subtle timing windows and bluff cues become legible.",,Solo|Legacy,Party,52.59,3,8,61,"Nimbus Games","Soraya Kline",2002,/images/fixtures/game_0781.png,2025-06-20T21:39:05+00:00,2026-03-26T10:29:41+00:00,"-0.0012,0.7622,-0.3943,-0.386,-0.2749,0.1951,0.6019,-0.1219"
782,"Inis Strategic","Inis Strategic opens like a classic Deck Building game, then quickly reveals Tile Laying layers that reward long-form table memory. Campaign logs track table history, so failed gambits still unlock content; expect up to 9 relic-style upgrades that alter scoring priorities. Expect repeat plays to diverge quickly: opening lines may look familiar, but midgame states rarely resolve the same way twice.",,"Campaign|Tile Laying|Engine Building|Miniatures","Deck Building",65.10,2,8,56,"Indigo Forge","Elliot Mercer",2012,/images/fixtures/game_0782.png,2025-11-13T01:42:24+00:00,2026-03-26T10:29:41+00:00,"-0.0806,0.6661,0.482,-0.1902,0.6287,-0.7973,0.4568,-0.3569"
783,"Silos under Campaign","Part campaign and part systems puzzle, Silos under Campaign asks 2–3 players players to master Party priorities under attritional pressure. Its Party framework encourages risky pivots, especially once table politics reshape priorities. Economy rails are intentionally unstable: once players trigger threshold events, 5 new scoring hooks reshape optimal lines. Because scoring vectors drift over time, tables that over-specialize early often get punished once Engine Building effects begin stacking. Few designs blend Party and Engine Building this smoothly while remaining approachable across varied player counts.",,"Engine Building|Campaign|Legacy",Party,23.91,1,7,51,"Nimbus Games","Elliot Mercer",2013,/images/fixtures/game_0783.png,2025-07-01T01:42:17+00:00,2026-03-26T10:29:41+00:00,"-0.4719,-0.2195,-0.8812,0.6404,-0.9209,0.2022,-0.686,0.2148"
784,"Cosmic Voyage","Built around Thematic systems, Cosmic Voyage pushes Campaign choices across 13 linked sessions and rewards tables that enjoy merchant drama. Scenario goals favor adaptive teams: one mission asks for diplomatic efficiency, the next demands aggressive engine conversion under time pressure. Campaign logs track table history, so failed gambits still unlock content; expect up to 5 relic-style upgrades that alter scoring priorities. Only adaptable crews master Cosmic Voyage, where legacy stickers permanently buff underused strategies and long-term planning matter as much as tactical brilliance.",,Cards|Campaign|Dice,Thematic,48.30,1,10,108,"Indigo Forge","Lena Ortiz",1998,/images/fixtures/game_0784.png,2025-04-13T10:09:22+00:00,2026-03-26T10:29:41+00:00,"0.9886,-0.54,-0.3667,0.7638,0.8357,0.7545,0.0953,0.2588"
785,"Ego under Peacocks","Ego under Peacocks blends Co-op structure with Campaign chaos, delivering 124-minute arcs where every decision compounds into later chapters. Its Co-op framework encourages risky pivots, especially once table politics reshape priorities. Core turns revolve around initiative bidding: commit actions, resolve conflicts, then pivot as event decks introduce 9 escalating complications. Scenario goals favor adaptive teams: one mission asks for diplomatic efficiency, the next demands aggressive engine conversion under time pressure. Win or lose, Ego under Peacocks tends to produce table stories that reference specific gambits and betrayals for weeks afterward.",,Solo|Campaign,Co-op,29.11,4,6,57,"Indigo Forge","Marcus Thorne",2012,/images/fixtures/game_0785.png,2025-06-19T00:11:29+00:00,2026-03-26T10:29:41+00:00,"0.927,-0.3165,-0.6564,0.9194,-0.5928,0.9597,0.3874,0.129"
786,"Negotiation Labyrinth","Designed for expert optimization tables, Negotiation Labyrinth channels guild conspiracies into a ruleset that stays readable while outcomes stay unpredictable. A standout mechanic tied to Legacy means even safe plans can collapse if opponents read your tempo one round ahead. Core turns revolve around real-time bursts: commit actions, resolve conflicts, then pivot as event decks introduce 7 escalating complications. Few designs blend Party and Legacy this smoothly while remaining approachable across varied player counts.",,Solo|Legacy|Campaign,Party,52.35,1,6,46,"Clockwork Labs","Nico Valdez",2016,/images/fixtures/game_0786.png,2025-09-05T14:52:16+00:00,2026-03-26T10:29:41+00:00,"-0.696,-0.4283,0.5019,0.3885,-0.582,-0.6691,0.4412,0.4916"
787,"Bazaar of Observatory","Bazaar of Observatory is a campaign-first Deck Building title for 2–3 players that leans into Solo, Miniatures and Tile Laying and simultaneous planning play. Hidden information is sparse but impactful, creating tense reveals that reward inference rather than guesswork. By mid-campaign, 5 relic slots and rotating objectives create dense interaction where denial play is as valuable as raw points. The late game stays dramatic without becoming random, making each finale feel like the natural consequence of earlier risks.",,"Solo|Miniatures|Tile Laying","Deck Building",22.40,2,9,56,"Indigo Forge","Marcus Thorne",2014,/images/fixtures/game_0787.png,2025-11-08T15:13:09+00:00,2026-03-26T10:29:41+00:00,"-0.1184,-0.3619,0.0815,-0.2549,0.7389,0.1054,-0.4573,0.9402"
788,"Azul for Guild","Azul for Guild opens like a classic Deck Building game, then quickly reveals Campaign layers that reward long-form table memory. Campaign logs track table history, so failed gambits still unlock content; expect up to 9 relic-style upgrades that alter scoring priorities. Few designs blend Deck Building and Campaign this smoothly while remaining approachable across varied player counts.",,"Campaign|Dice|Tile Laying","Deck Building",21.62,4,8,156,"Clockwork Labs","Marcus Thorne",1996,/images/fixtures/game_0788.png,2025-11-27T04:28:36+00:00,2026-03-26T10:29:41+00:00,"-0.605,0.0885,0.9501,0.6474,-0.8239,-0.6443,0.1612,-0.5914"
