id,title,description,image_prompt,tags,categories,price,player_count_min,player_count_max,play_time_minutes,publisher,designer,release_year,image_url,created_at,updated_at,description_vector
257,"Forgotten Sanctum","Built around Eurogame systems, Forgotten Sanctum pushes Dice choices across 5 linked sessions and rewards tables that enjoy frontier diplomacy. Scenario goals favor adaptive teams: one mission asks for diplomatic efficiency, the next demands aggressive engine conversion under time pressure. Action windows stay short, but consequence chains run long, especially in sessions around 154 minutes where adaptation beats scripted play. Few designs blend Eurogame and Dice this smoothly while remaining approachable across varied player counts.",,Campaign|Dice,Eurogame,84.43,4,7,115,"Arcana Works","Elliot Mercer",1995,/images/fixtures/game_0257.png,2025-07-11T03:42:50+00:00,2026-03-25T06:56:50+00:00,"-0.33,-0.4873,0.4446,-0.5389,0.3952,-0.5738,0.2049,0.2901"
258,"Tatari Stressful","Tatari Stressful blends Abstract structure with Solo chaos, delivering 133-minute arcs where every decision compounds into later chapters. Scenario goals favor adaptive teams: one mission asks for diplomatic efficiency, the next demands aggressive engine conversion under time pressure. Campaign logs track table history, so failed gambits still unlock content; expect up to 5 relic-style upgrades that alter scoring priorities. Win or lose, Tatari Stressful tends to produce table stories that reference specific gambits and betrayals for weeks afterward.",,"Tile Laying|Solo",Abstract,43.52,3,8,126,"Indigo Forge","Nico Valdez",1994,/images/fixtures/game_0258.png,2025-06-14T16:53:37+00:00,2026-03-25T06:56:50+00:00,"0.5474,-0.6653,-0.6805,-0.5079,0.721,-0.7177,-0.6907,0.0454"
259,"Silos: Monolith","Silos: Monolith opens like a classic Strategy game, then quickly reveals Cards layers that reward long-form table memory. Its Strategy framework encourages risky pivots, especially once table politics reshape priorities. By mid-campaign, 7 relic slots and rotating objectives create dense interaction where denial play is as valuable as raw points. Rule overhead stays modest thanks to consistent icon grammar, even while strategic depth rises sharply after the first two plays. Win or lose, Silos: Monolith tends to produce table stories that reference specific gambits and betrayals for weeks afterward.",,Cards|Dice,Strategy,76.83,3,10,143,"Nimbus Games","Soraya Kline",2018,/images/fixtures/game_0259.png,2025-06-29T17:07:05+00:00,2026-03-25T06:56:50+00:00,"0.4053,0.3955,0.3987,-0.2733,0.5274,-0.5191,0.4298,-0.7455"
260,"Heat Persistent","Designed for expert optimization tables, Heat Persistent channels arcane rivalry into a ruleset that stays readable while outcomes stay unpredictable. Because scoring vectors drift over time, tables that over-specialize early often get punished once Campaign effects begin stacking. Your group manages feast-or-famine economies while chasing milestone bonuses; by chapter 6 the board can contain over 22 modular tiles. Few designs blend Family and Campaign this smoothly while remaining approachable across varied player counts.",,Campaign|Miniatures|Solo,Family,66.89,3,9,98,"Nimbus Games","Nico Valdez",2020,/images/fixtures/game_0260.png,2025-10-28T03:34:56+00:00,2026-03-25T06:56:50+00:00,"-0.5642,-0.5083,-0.2457,0.2265,0.0485,0.2375,0.6991,0.7077"
261,"Inis without Zoo Vadis","At its core, Inis without Zoo Vadis is a Party design where Miniatures, Tile Laying and Legacy mechanisms collide with draft-and-resolve rounds pacing for 1–4 players groups. Rule overhead stays modest thanks to consistent icon grammar, even while strategic depth rises sharply after the first two plays. Your group manages scarce economies while chasing milestone bonuses; by chapter 4 the board can contain over 16 modular tiles. If your table likes post-game debriefs, Inis without Zoo Vadis will spark them—nearly every finale feels earned, messy, and memorable.",,"Miniatures|Tile Laying|Legacy",Party,86.77,2,8,38,"Indigo Forge","Nico Valdez",1993,/images/fixtures/game_0261.png,2025-11-10T17:29:19+00:00,2026-03-25T06:56:50+00:00,"-0.7888,0.789,-0.3328,0.5356,0.1743,0.2691,0.527,-0.9485"
262,"Forge under Tatari","Forge under Tatari opens like a classic Thematic game, then quickly reveals Engine Building layers that reward long-form table memory. Its Thematic framework encourages risky pivots, especially once table politics reshape priorities. Map states remain highly legible despite scale; by late game, up to 25 tiles and layered markers support deep positional planning. Scenario goals favor adaptive teams: one mission asks for diplomatic efficiency, the next demands aggressive engine conversion under time pressure. Few designs blend Thematic and Engine Building this smoothly while remaining approachable across varied player counts.",,"Engine Building|Cards|Solo",Thematic,22.98,4,10,57,"Nimbus Games","Lena Ortiz",2010,/images/fixtures/game_0262.png,2026-02-20T14:43:07+00:00,2026-03-25T06:56:50+00:00,"0.445,-0.0159,-0.3238,-0.7908,0.8373,-0.4993,-0.9368,0.9057"
263,"Ego Mythic","At its core, Ego Mythic is a Eurogame design where Dice and Solo mechanisms collide with programmed actions pacing for 1–8 players groups. Campaign logs track table history, so failed gambits still unlock content; expect up to 9 relic-style upgrades that alter scoring priorities. Veteran groups report that Ego Mythic shines brightest after a few sessions, once subtle timing windows and bluff cues become legible.",,Dice|Solo,Eurogame,86.37,4,9,171,"Silver Oak Studio","Akira Flynn",2003,/images/fixtures/game_0263.png,2025-11-20T17:23:49+00:00,2026-03-25T06:56:50+00:00,"-0.6361,0.1339,0.0622,-0.9307,-0.4817,0.9828,-0.9254,0.6092"
264,"Patient Maze","Built around Co-op systems, Patient Maze pushes Tile Laying choices across 5 linked sessions and rewards tables that enjoy mythic restoration. Its Co-op framework encourages risky pivots, especially once table politics reshape priorities. Action windows stay short, but consequence chains run long, especially in sessions around 80 minutes where adaptation beats scripted play. Scenario goals favor adaptive teams: one mission asks for diplomatic efficiency, the next demands aggressive engine conversion under time pressure. Few designs blend Co-op and Tile Laying this smoothly while remaining approachable across varied player counts.",,"Engine Building|Miniatures|Tile Laying",Co-op,27.50,4,8,84,"Silver Oak Studio","Akira Flynn",2023,/images/fixtures/game_0264.png,2025-12-19T09:52:38+00:00,2026-03-25T06:56:50+00:00,"0.4765,-0.6709,0.8613,-0.4833,-0.5859,0.4958,0.605,-0.7207"
265,"Trailblazers without Scout","Designed for campaign-first tables, Trailblazers without Scout channels mythic restoration into a ruleset that stays readable while outcomes stay unpredictable. Scenario goals favor adaptive teams: one mission asks for diplomatic efficiency, the next demands aggressive engine conversion under time pressure. Round structure forces meaningful tradeoffs between tempo and efficiency; over 5 chapters, even small resource leaks become strategic liabilities. If your table likes post-game debriefs, Trailblazers without Scout will spark them—nearly every finale feels earned, messy, and memorable.",,"Tile Laying|Dice|Campaign",Abstract,84.19,4,8,68,"Silver Oak Studio","Nico Valdez",2014,/images/fixtures/game_0265.png,2025-06-16T10:41:06+00:00,2026-03-25T06:56:50+00:00,"-0.1526,-0.0963,0.8586,-0.5443,0.6469,-0.4659,-0.1621,0.7512"
266,"Emerald Caravan","Designed for family-plus strategy tables, Emerald Caravan channels arcane rivalry into a ruleset that stays readable while outcomes stay unpredictable. Its Party framework encourages risky pivots, especially once table politics reshape priorities. Action windows stay short, but consequence chains run long, especially in sessions around 94 minutes where adaptation beats scripted play. Component design supports readability at scale: icon-first cards, layered reference boards, and phase reminders keep late-game turns moving. Only adaptable crews master Emerald Caravan, where the map physically changes every era and long-term planning matter as much as tactical brilliance.",,"Solo|Cards|Tile Laying|Engine Building",Party,86.56,3,5,62,"Clockwork Labs","Akira Flynn",1990,/images/fixtures/game_0266.png,2026-01-29T13:33:05+00:00,2026-03-25T06:56:50+00:00,"-0.2962,0.0206,0.0373,-0.6904,0.352,-0.1109,-0.3037,-0.4053"
267,"Inis Persistent","Inis Persistent opens like a classic Thematic game, then quickly reveals Campaign layers that reward long-form table memory. Its Thematic framework encourages risky pivots, especially once table politics reshape priorities. Your group manages risk-loaded economies while chasing milestone bonuses; by chapter 5 the board can contain over 19 modular tiles. Mission cadence alternates between tactical crunch and narrative resolution, preventing decision fatigue while preserving competitive tension. Win or lose, Inis Persistent tends to produce table stories that reference specific gambits and betrayals for weeks afterward.",,"Legacy|Tile Laying|Campaign",Thematic,21.62,4,5,103,"Indigo Forge","Lena Ortiz",2017,/images/fixtures/game_0267.png,2025-11-03T20:15:07+00:00,2026-03-25T06:56:50+00:00,"-0.8578,0.9628,-0.6946,-0.7657,-0.5851,-0.064,0.1834,-0.8714"
268,"Royal Legion","Part campaign and part systems puzzle, Royal Legion asks 1–6 players players to master Eurogame priorities under attritional pressure. Economy rails are intentionally unstable: once players trigger threshold events, 4 new scoring hooks reshape optimal lines. If your table likes post-game debriefs, Royal Legion will spark them—nearly every finale feels earned, messy, and memorable.",,Legacy|Dice,Eurogame,77.36,1,8,33,"Indigo Forge","Elliot Mercer",2014,/images/fixtures/game_0268.png,2025-07-05T08:47:22+00:00,2026-03-25T06:56:50+00:00,"0.9579,0.9671,-0.6041,0.7648,-0.1205,0.5444,-0.8962,-0.7576"
269,"Scout: Forge","Scout: Forge is a expert optimization Eurogame title for 2–7 players that leans into Dice and Tile Laying and sequential tactical turns play. Scenario goals favor adaptive teams: one mission asks for diplomatic efficiency, the next demands aggressive engine conversion under time pressure. Round structure forces meaningful tradeoffs between tempo and efficiency; over 6 chapters, even small resource leaks become strategic liabilities. Expect repeat plays to diverge quickly: opening lines may look familiar, but midgame states rarely resolve the same way twice.",,"Dice|Tile Laying",Eurogame,40.65,3,5,137,"Nimbus Games","Lena Ortiz",1993,/images/fixtures/game_0269.png,2025-10-18T08:44:47+00:00,2026-03-25T06:56:50+00:00,"0.2718,0.0419,0.9577,-0.4018,-0.1085,-0.7016,0.9604,0.4531"
270,"Legendary Reckoning","Legendary Reckoning blends Eurogame structure with Cards chaos, delivering 80-minute arcs where every decision compounds into later chapters. Mission cadence alternates between tactical crunch and narrative resolution, preventing decision fatigue while preserving competitive tension. Round structure forces meaningful tradeoffs between tempo and efficiency; over 4 chapters, even small resource leaks become strategic liabilities. If your group values depth with momentum, this one delivers a rare mix of sharp tactical play and evolving campaign texture.",,"Solo|Tile Laying|Legacy|Cards",Eurogame,32.41,1,8,161,"Indigo Forge","Akira Flynn",2007,/images/fixtures/game_0270.png,2025-07-06T16:43:01+00:00,2026-03-25T06:56:50+00:00,"0.2117,-0.4619,0.9745,-0.5695,-0.3872,0.0309,-0.8255,0.4065"
271,"Orbit: Peacocks","Built around Family systems, Orbit: Peacocks pushes Tile Laying choices across 6 linked sessions and rewards tables that enjoy arcane rivalry. Its Family framework encourages risky pivots, especially once table politics reshape priorities. Action windows stay short, but consequence chains run long, especially in sessions around 165 minutes where adaptation beats scripted play. Hidden information is sparse but impactful, creating tense reveals that reward inference rather than guesswork. Veteran groups report that Orbit: Peacocks shines brightest after a few sessions, once subtle timing windows and bluff cues become legible.",,"Dice|Tile Laying|Legacy",Family,74.19,4,9,35,"Arcana Works","Nico Valdez",2015,/images/fixtures/game_0271.png,2025-11-14T19:15:13+00:00,2026-03-25T06:56:50+00:00,"0.4947,-0.6136,0.4316,0.8666,0.5423,0.7519,-0.9635,0.1184"
272,"Ichor of Monolith","At its core, Ichor of Monolith is a Abstract design where Tile Laying, Engine Building, Solo and Cards mechanisms collide with initiative bidding pacing for 1–3 players groups. Campaign logs track table history, so failed gambits still unlock content; expect up to 7 relic-style upgrades that alter scoring priorities. Expect repeat plays to diverge quickly: opening lines may look familiar, but midgame states rarely resolve the same way twice.",,"Tile Laying|Engine Building|Solo|Cards",Abstract,34.51,1,6,156,"Silver Oak Studio","Soraya Kline",2023,/images/fixtures/game_0272.png,2025-07-14T20:54:00+00:00,2026-03-25T06:56:50+00:00,"-0.3414,0.5262,-0.835,-0.8861,-0.7705,0.8008,-0.6454,0.4949"
273,"Ra Verdant","Ra Verdant frames city-building tension as a living sandbox: each scenario escalates pressure while 1–7 players teams improvise around shifting incentives. Its Eurogame framework encourages risky pivots, especially once table politics reshape priorities. Action windows stay short, but consequence chains run long, especially in sessions around 166 minutes where adaptation beats scripted play. Rule overhead stays modest thanks to consistent icon grammar, even while strategic depth rises sharply after the first two plays. Win or lose, Ra Verdant tends to produce table stories that reference specific gambits and betrayals for weeks afterward.",,"Dice|Solo|Tile Laying",Eurogame,73.23,2,10,103,"Silver Oak Studio","Marcus Thorne",2013,/images/fixtures/game_0273.png,2025-06-11T01:58:27+00:00,2026-03-25T06:56:50+00:00,"-0.5592,-0.5138,-0.4481,-0.7575,-0.832,-0.1704,0.9264,-0.7158"
274,"Thrilling Orbit","Part campaign and part systems puzzle, Thrilling Orbit asks 1–5 players players to master Eurogame priorities under swingy pressure. Its Eurogame framework encourages risky pivots, especially once table politics reshape priorities. Campaign logs track table history, so failed gambits still unlock content; expect up to 9 relic-style upgrades that alter scoring priorities. Hidden information is sparse but impactful, creating tense reveals that reward inference rather than guesswork. Win or lose, Thrilling Orbit tends to produce table stories that reference specific gambits and betrayals for weeks afterward.",,Legacy|Solo|Miniatures,Eurogame,83.47,2,8,109,"Indigo Forge","Marcus Thorne",2012,/images/fixtures/game_0274.png,2026-02-21T04:03:00+00:00,2026-03-25T06:56:50+00:00,"0.6028,-0.0005,0.9719,-0.3638,-0.0654,0.0299,-0.6654,-0.6434"
275,"Tactical Comet","Designed for mid-weight hobby tables, Tactical Comet channels merchant drama into a ruleset that stays readable while outcomes stay unpredictable. Scenario goals favor adaptive teams: one mission asks for diplomatic efficiency, the next demands aggressive engine conversion under time pressure. Round structure forces meaningful tradeoffs between tempo and efficiency; over 4 chapters, even small resource leaks become strategic liabilities. Veteran groups report that Tactical Comet shines brightest after a few sessions, once subtle timing windows and bluff cues become legible.",,"Campaign|Engine Building|Cards|Dice",Family,54.65,2,7,146,"Silver Oak Studio","Elliot Mercer",2024,/images/fixtures/game_0275.png,2025-12-01T20:17:58+00:00,2026-03-25T06:56:50+00:00,"0.8688,-0.5785,-0.3635,-0.403,-0.264,-0.1128,-0.2844,0.4215"
276,"Inis: Kingdom","Inis: Kingdom frames arcane rivalry as a living sandbox: each scenario escalates pressure while 2–8 players teams improvise around shifting incentives. Its Deck Building framework encourages risky pivots, especially once table politics reshape priorities. By mid-campaign, 4 relic slots and rotating objectives create dense interaction where denial play is as valuable as raw points. Component design supports readability at scale: icon-first cards, layered reference boards, and phase reminders keep late-game turns moving. Only adaptable crews master Inis: Kingdom, where players vote to rewrite one core rule each chapter and long-term planning matter as much as tactical brilliance.",,"Tile Laying|Dice","Deck Building",84.87,2,7,116,"Indigo Forge","Soraya Kline",2022,/images/fixtures/game_0276.png,2025-04-23T18:12:12+00:00,2026-03-25T06:56:50+00:00,"0.5214,-0.668,-0.419,-0.7495,0.3536,-0.9607,-0.7025,0.0191"
277,"Heat: Scout","At its core, Heat: Scout is a Eurogame design where Cards, Miniatures and Dice mechanisms collide with initiative bidding pacing for 1–3 players groups. Hidden information is sparse but impactful, creating tense reveals that reward inference rather than guesswork. Round structure forces meaningful tradeoffs between tempo and efficiency; over 3 chapters, even small resource leaks become strategic liabilities. If your group values depth with momentum, this one delivers a rare mix of sharp tactical play and evolving campaign texture.",,Cards|Miniatures|Dice,Eurogame,46.81,2,9,133,"Arcana Works","Lena Ortiz",2024,/images/fixtures/game_0277.png,2025-08-02T12:09:42+00:00,2026-03-25T06:56:50+00:00,"-0.0992,-0.8009,0.1075,-0.1619,-0.1498,-0.5744,0.8021,-0.9055"
278,"Heat: Zoo Vadis","Heat: Zoo Vadis is a newcomer-friendly Eurogame title for 1–4 players that leans into Dice and Legacy and simultaneous planning play. Campaign logs track table history, so failed gambits still unlock content; expect up to 3 relic-style upgrades that alter scoring priorities. Few designs blend Eurogame and Dice this smoothly while remaining approachable across varied player counts.",,Dice|Legacy,Eurogame,89.77,4,8,52,"Indigo Forge","Nico Valdez",2015,/images/fixtures/game_0278.png,2025-05-28T23:50:20+00:00,2026-03-25T06:56:50+00:00,"0.678,0.2661,-0.0044,-0.3091,-0.5365,-0.6823,-0.614,0.8556"
279,"Nana beyond Citadel","At its core, Nana beyond Citadel is a Abstract design where Miniatures, Dice and Legacy mechanisms collide with real-time bursts pacing for 2–3 players groups. Its Abstract framework encourages risky pivots, especially once table politics reshape priorities. Round structure forces meaningful tradeoffs between tempo and efficiency; over 4 chapters, even small resource leaks become strategic liabilities. A standout mechanic tied to Legacy means even safe plans can collapse if opponents read your tempo one round ahead. Only adaptable crews master Nana beyond Citadel, where a shared market board rewards temporary cooperation and long-term planning matter as much as tactical brilliance.",,Miniatures|Dice|Legacy,Abstract,25.36,2,10,124,"Indigo Forge","Nico Valdez",2024,/images/fixtures/game_0279.png,2025-06-14T03:14:15+00:00,2026-03-25T06:56:50+00:00,"0.9123,-0.5349,0.03,-0.1816,0.4533,-0.035,0.4546,0.8272"
280,"Silos: Reckoning","Silos: Reckoning opens like a classic Co-op game, then quickly reveals Legacy layers that reward long-form table memory. Its Co-op framework encourages risky pivots, especially once table politics reshape priorities. Campaign logs track table history, so failed gambits still unlock content; expect up to 6 relic-style upgrades that alter scoring priorities. Mission cadence alternates between tactical crunch and narrative resolution, preventing decision fatigue while preserving competitive tension. Few designs blend Co-op and Legacy this smoothly while remaining approachable across varied player counts.",,"Legacy|Miniatures|Cards|Tile Laying",Co-op,80.58,4,10,156,"Arcana Works","Lena Ortiz",2015,/images/fixtures/game_0280.png,2025-09-18T14:01:52+00:00,2026-03-25T06:56:50+00:00,"-0.8657,-0.1166,0.1971,-0.834,-0.542,-0.6724,0.7033,-0.5775"
281,"Epic Ego","Epic Ego frames political intrigue as a living sandbox: each scenario escalates pressure while 2–8 players teams improvise around shifting incentives. Campaign logs track table history, so failed gambits still unlock content; expect up to 5 relic-style upgrades that alter scoring priorities. If your table likes post-game debriefs, Epic Ego will spark them—nearly every finale feels earned, messy, and memorable.",,"Cards|Miniatures|Tile Laying|Dice",Party,42.88,1,10,78,"Arcana Works","Nico Valdez",2008,/images/fixtures/game_0281.png,2025-05-29T08:07:47+00:00,2026-03-25T06:56:50+00:00,"-0.6672,0.5055,0.6771,-0.1288,0.6915,-0.1265,-0.2745,-0.2343"
282,"Ironclad Island","Ironclad Island frames frontier diplomacy as a living sandbox: each scenario escalates pressure while 1–6 players teams improvise around shifting incentives. Its Abstract framework encourages risky pivots, especially once table politics reshape priorities. Campaign logs track table history, so failed gambits still unlock content; expect up to 8 relic-style upgrades that alter scoring priorities. Because scoring vectors drift over time, tables that over-specialize early often get punished once Miniatures effects begin stacking. Expect repeat plays to diverge quickly: opening lines may look familiar, but midgame states rarely resolve the same way twice.",,"Miniatures|Tile Laying|Dice|Solo",Abstract,84.46,2,6,68,"Indigo Forge","Lena Ortiz",1991,/images/fixtures/game_0282.png,2025-09-27T02:13:28+00:00,2026-03-25T06:56:50+00:00,"0.3715,0.9801,-0.1029,-0.5983,0.5976,-0.5792,0.6601,-0.32"
283,"Zoo Vadis Frontier","Zoo Vadis Frontier is a expert optimization Strategy title for 1–5 players that leans into Cards, Engine Building, Campaign and Legacy and sequential tactical turns play. Its Strategy framework encourages risky pivots, especially once table politics reshape priorities. Core turns revolve around sequential tactical turns: commit actions, resolve conflicts, then pivot as event decks introduce 7 escalating complications. Negotiation matters more than it first appears; temporary coalitions routinely form, fracture, and reform inside a single chapter. The late game stays dramatic without becoming random, making each finale feel like the natural consequence of earlier risks.",,"Cards|Engine Building|Campaign|Legacy",Strategy,73.77,2,9,104,"Arcana Works","Marcus Thorne",1996,/images/fixtures/game_0283.png,2025-12-18T07:22:11+00:00,2026-03-25T06:56:50+00:00,"0.4885,-0.9778,0.7566,0.0799,-0.4622,-0.0712,-0.6801,0.2189"
284,"Trio: Citadel","Trio: Citadel opens like a classic Abstract game, then quickly reveals Legacy layers that reward long-form table memory. Negotiation matters more than it first appears; temporary coalitions routinely form, fracture, and reform inside a single chapter. Map states remain highly legible despite scale; by late game, up to 18 tiles and layered markers support deep positional planning. Veteran groups report that Trio: Citadel shines brightest after a few sessions, once subtle timing windows and bluff cues become legible.",,Miniatures|Legacy|Campaign,Abstract,79.45,1,7,133,"Arcana Works","Lena Ortiz",2006,/images/fixtures/game_0284.png,2025-08-01T04:01:56+00:00,2026-03-25T06:56:50+00:00,"0.8927,-0.7247,0.8134,-0.5262,0.8492,-0.3537,0.635,-0.6553"
285,"Ego under Arena","Built around Family systems, Ego under Arena pushes Engine Building choices across 13 linked sessions and rewards tables that enjoy mythic restoration. Its Family framework encourages risky pivots, especially once table politics reshape priorities. Core turns revolve around draft-and-resolve rounds: commit actions, resolve conflicts, then pivot as event decks introduce 5 escalating complications. Scenario goals favor adaptive teams: one mission asks for diplomatic efficiency, the next demands aggressive engine conversion under time pressure. If your table likes post-game debriefs, Ego under Arena will spark them—nearly every finale feels earned, messy, and memorable.",,"Engine Building|Legacy|Tile Laying",Family,36.05,4,6,56,"Arcana Works","Lena Ortiz",1990,/images/fixtures/game_0285.png,2025-06-19T05:09:48+00:00,2026-03-25T06:56:50+00:00,"-0.9565,-0.126,-0.7371,0.6338,0.3088,-0.3343,0.6738,-0.056"
286,"Azul: Maze","Built around Strategy systems, Azul: Maze pushes Miniatures choices across 13 linked sessions and rewards tables that enjoy city-building tension. Because scoring vectors drift over time, tables that over-specialize early often get punished once Miniatures effects begin stacking. By mid-campaign, 10 relic slots and rotating objectives create dense interaction where denial play is as valuable as raw points. Win or lose, Azul: Maze tends to produce table stories that reference specific gambits and betrayals for weeks afterward.",,Dice|Solo|Miniatures|Cards,Strategy,71.71,4,6,142,"Silver Oak Studio","Marcus Thorne",1997,/images/fixtures/game_0286.png,2026-02-24T00:34:16+00:00,2026-03-25T06:56:50+00:00,"0.866,0.2526,-0.703,0.3301,0.5631,0.4921,0.715,0.7677"
287,"Arcane Horizon","Designed for expert optimization tables, Arcane Horizon channels political intrigue into a ruleset that stays readable while outcomes stay unpredictable. Map states remain highly legible despite scale; by late game, up to 20 tiles and layered markers support deep positional planning. The late game stays dramatic without becoming random, making each finale feel like the natural consequence of earlier risks.",,"Dice|Legacy|Tile Laying|Engine Building",Eurogame,72.70,4,5,38,"Arcana Works","Akira Flynn",2012,/images/fixtures/game_0287.png,2025-09-23T08:48:53+00:00,2026-03-25T06:56:50+00:00,"-0.4474,0.737,0.2613,-0.5394,-0.3792,0.1728,-0.6214,-0.5734"
