id,title,description,image_prompt,tags,categories,price,player_count_min,player_count_max,play_time_minutes,publisher,designer,release_year,image_url,created_at,updated_at,description_vector
736,"Tigris and Euphrates Asymmetric","Designed for mid-weight hobby tables, Tigris and Euphrates Asymmetric channels merchant drama into a ruleset that stays readable while outcomes stay unpredictable. Rule overhead stays modest thanks to consistent icon grammar, even while strategic depth rises sharply after the first two plays. Core turns revolve around real-time bursts: commit actions, resolve conflicts, then pivot as event decks introduce 8 escalating complications. The late game stays dramatic without becoming random, making each finale feel like the natural consequence of earlier risks.",,"Miniatures|Engine Building|Cards|Legacy",Thematic,76.32,4,10,38,"Silver Oak Studio","Marcus Thorne",2010,/images/fixtures/game_0736.png,2025-09-06T11:18:04+00:00,2026-03-25T06:56:50+00:00,"-0.9322,-0.3477,0.1347,-0.9569,-0.7979,0.0393,0.3242,0.7828"
737,"Hidden Nebula","At its core, Hidden Nebula is a Family design where Engine Building, Cards, Legacy and Solo mechanisms collide with initiative bidding pacing for 1–4 players groups. Core turns revolve around initiative bidding: commit actions, resolve conflicts, then pivot as event decks introduce 9 escalating complications. Win or lose, Hidden Nebula tends to produce table stories that reference specific gambits and betrayals for weeks afterward.",,"Engine Building|Cards|Legacy|Solo",Family,41.61,2,5,45,"Nimbus Games","Nico Valdez",1995,/images/fixtures/game_0737.png,2025-07-19T17:55:23+00:00,2026-03-25T06:56:50+00:00,"0.0582,0.5368,0.7726,-0.9886,-0.9229,-0.976,-0.3472,0.3114"
738,"Ethereal Kingdom","Part campaign and part systems puzzle, Ethereal Kingdom asks 2–5 players players to master Thematic priorities under swingy pressure. Rule overhead stays modest thanks to consistent icon grammar, even while strategic depth rises sharply after the first two plays. Your group manages swingy economies while chasing milestone bonuses; by chapter 4 the board can contain over 12 modular tiles. If your group values depth with momentum, this one delivers a rare mix of sharp tactical play and evolving campaign texture.",,"Miniatures|Campaign|Tile Laying",Thematic,26.07,4,7,40,"Silver Oak Studio","Elliot Mercer",1999,/images/fixtures/game_0738.png,2025-12-03T10:43:57+00:00,2026-03-25T06:56:50+00:00,"-0.0304,-0.6371,0.6401,0.5918,-0.6239,-0.689,-0.369,-0.6829"
739,"Maze for Alliance","Designed for expert optimization tables, Maze for Alliance channels expedition survival into a ruleset that stays readable while outcomes stay unpredictable. Campaign logs track table history, so failed gambits still unlock content; expect up to 6 relic-style upgrades that alter scoring priorities. Only adaptable crews master Maze for Alliance, where weather tracks alter core action costs between rounds and long-term planning matter as much as tactical brilliance.",,"Miniatures|Cards|Engine Building|Legacy",Strategy,54.68,3,10,142,"Nimbus Games","Elliot Mercer",2019,/images/fixtures/game_0739.png,2025-04-28T18:35:59+00:00,2026-03-25T06:56:50+00:00,"0.6507,-0.2758,-0.534,-0.3006,-0.1254,-0.6933,-0.8868,0.8762"
740,"Conclave against Caravan","Built around Abstract systems, Conclave against Caravan pushes Cards choices across 8 linked sessions and rewards tables that enjoy expedition survival. Component design supports readability at scale: icon-first cards, layered reference boards, and phase reminders keep late-game turns moving. Round structure forces meaningful tradeoffs between tempo and efficiency; over 7 chapters, even small resource leaks become strategic liabilities. The late game stays dramatic without becoming random, making each finale feel like the natural consequence of earlier risks.",,"Cards|Engine Building|Miniatures",Abstract,42.93,4,10,112,"Indigo Forge","Marcus Thorne",2007,/images/fixtures/game_0740.png,2025-06-28T15:36:02+00:00,2026-03-25T06:56:50+00:00,"-0.8932,0.2411,-0.253,-0.3293,0.4208,-0.1961,-0.0849,-0.5889"
741,"Tigris and Euphrates: Council","Tigris and Euphrates: Council is a brain-burner Co-op title for 2–5 players that leans into Solo, Cards, Engine Building and Legacy and simultaneous planning play. Negotiation matters more than it first appears; temporary coalitions routinely form, fracture, and reform inside a single chapter. Campaign logs track table history, so failed gambits still unlock content; expect up to 3 relic-style upgrades that alter scoring priorities. If your table likes post-game debriefs, Tigris and Euphrates: Council will spark them—nearly every finale feels earned, messy, and memorable.",,"Solo|Cards|Engine Building|Legacy",Co-op,86.30,3,8,36,"Silver Oak Studio","Nico Valdez",2000,/images/fixtures/game_0741.png,2025-04-30T06:15:35+00:00,2026-03-25T06:56:50+00:00,"-0.0622,-0.9422,0.2341,-0.1209,0.0723,0.1483,0.9697,0.8046"
742,"Alliance of Legion","Part campaign and part systems puzzle, Alliance of Legion asks 1–5 players players to master Abstract priorities under risk-loaded pressure. Its Abstract framework encourages risky pivots, especially once table politics reshape priorities. Core turns revolve around real-time bursts: commit actions, resolve conflicts, then pivot as event decks introduce 8 escalating complications. A standout mechanic tied to Cards means even safe plans can collapse if opponents read your tempo one round ahead. The late game stays dramatic without becoming random, making each finale feel like the natural consequence of earlier risks.",,Legacy|Cards,Abstract,69.60,2,8,123,"Silver Oak Studio","Soraya Kline",2017,/images/fixtures/game_0742.png,2025-09-26T08:21:22+00:00,2026-03-25T06:56:50+00:00,"-0.0081,-0.1852,-0.1881,0.6042,0.5811,0.2725,-0.1689,0.7294"
743,"Azul: Ichor","Azul: Ichor opens like a classic Abstract game, then quickly reveals Engine Building layers that reward long-form table memory. Because scoring vectors drift over time, tables that over-specialize early often get punished once Engine Building effects begin stacking. By mid-campaign, 8 relic slots and rotating objectives create dense interaction where denial play is as valuable as raw points. The late game stays dramatic without becoming random, making each finale feel like the natural consequence of earlier risks.",,"Miniatures|Engine Building|Cards",Abstract,83.77,1,8,74,"Silver Oak Studio","Soraya Kline",2021,/images/fixtures/game_0743.png,2025-08-29T01:28:32+00:00,2026-03-25T06:56:50+00:00,"0.2962,0.329,0.6899,0.2115,-0.6869,0.4018,-0.1884,0.8049"
744,"Nana under Championship","Part campaign and part systems puzzle, Nana under Championship asks 2–3 players players to master Eurogame priorities under tight pressure. Core turns revolve around initiative bidding: commit actions, resolve conflicts, then pivot as event decks introduce 6 escalating complications. Few designs blend Eurogame and Miniatures this smoothly while remaining approachable across varied player counts.",,"Legacy|Miniatures|Engine Building",Eurogame,51.22,4,7,104,"Clockwork Labs","Elliot Mercer",1990,/images/fixtures/game_0744.png,2025-07-26T06:32:27+00:00,2026-03-25T06:56:50+00:00,"-0.4269,-0.895,0.3498,0.6842,-0.733,-0.2596,-0.0669,0.1614"
745,"Elegant Frontier","Elegant Frontier frames expedition survival as a living sandbox: each scenario escalates pressure while 2–8 players teams improvise around shifting incentives. Its Deck Building framework encourages risky pivots, especially once table politics reshape priorities. Round structure forces meaningful tradeoffs between tempo and efficiency; over 5 chapters, even small resource leaks become strategic liabilities. Negotiation matters more than it first appears; temporary coalitions routinely form, fracture, and reform inside a single chapter. Only adaptable crews master Elegant Frontier, where a shared market board rewards temporary cooperation and long-term planning matter as much as tactical brilliance.",,"Engine Building|Solo","Deck Building",32.63,3,10,102,"Clockwork Labs","Marcus Thorne",2007,/images/fixtures/game_0745.png,2026-01-12T05:05:38+00:00,2026-03-25T06:56:50+00:00,"-0.2041,-0.37,0.5153,-0.2806,0.9079,-0.5945,0.8874,-0.6746"
746,"Patient Citadel","Built around Deck Building systems, Patient Citadel pushes Miniatures choices across 7 linked sessions and rewards tables that enjoy merchant drama. Because scoring vectors drift over time, tables that over-specialize early often get punished once Miniatures effects begin stacking. Core turns revolve around draft-and-resolve rounds: commit actions, resolve conflicts, then pivot as event decks introduce 4 escalating complications. If your group values depth with momentum, this one delivers a rare mix of sharp tactical play and evolving campaign texture.",,"Dice|Engine Building|Miniatures|Solo","Deck Building",88.78,2,8,167,"Nimbus Games","Marcus Thorne",2007,/images/fixtures/game_0746.png,2026-02-08T22:02:55+00:00,2026-03-25T06:56:50+00:00,"0.0136,0.5289,0.3048,-0.0436,0.2914,0.657,-0.8389,-0.3723"
747,"Inis Pedal","Inis Pedal is a mid-weight hobby Eurogame title for 2–6 players that leans into Campaign, Legacy, Solo and Dice and programmed actions play. By mid-campaign, 10 relic slots and rotating objectives create dense interaction where denial play is as valuable as raw points. If your table likes post-game debriefs, Inis Pedal will spark them—nearly every finale feels earned, messy, and memorable.",,Campaign|Legacy|Solo|Dice,Eurogame,66.24,4,9,138,"Arcana Works","Marcus Thorne",1992,/images/fixtures/game_0747.png,2026-03-12T18:41:58+00:00,2026-03-25T06:56:50+00:00,"-0.2526,-0.1774,0.6081,0.0517,-0.9478,-0.3406,-0.9639,0.5892"
748,"Tatari Competitive","Tatari Competitive is a brain-burner Party title for 2–6 players that leans into Cards, Miniatures, Solo and Tile Laying and draft-and-resolve rounds play. Core turns revolve around draft-and-resolve rounds: commit actions, resolve conflicts, then pivot as event decks introduce 9 escalating complications. Win or lose, Tatari Competitive tends to produce table stories that reference specific gambits and betrayals for weeks afterward.",,"Cards|Miniatures|Solo|Tile Laying",Party,64.37,2,6,35,"Nimbus Games","Lena Ortiz",1996,/images/fixtures/game_0748.png,2025-12-06T21:31:41+00:00,2026-03-25T06:56:50+00:00,"0.8971,-0.5338,0.5189,0.8984,0.4681,0.3795,0.9311,-0.1728"
749,"Ra Ambitious","Built around Thematic systems, Ra Ambitious pushes Engine Building choices across 5 linked sessions and rewards tables that enjoy city-building tension. By mid-campaign, 5 relic slots and rotating objectives create dense interaction where denial play is as valuable as raw points. Only adaptable crews master Ra Ambitious, where weather tracks alter core action costs between rounds and long-term planning matter as much as tactical brilliance.",,"Solo|Campaign|Engine Building|Dice",Thematic,49.15,1,9,63,"Silver Oak Studio","Lena Ortiz",2007,/images/fixtures/game_0749.png,2025-09-10T18:15:10+00:00,2026-03-25T06:56:50+00:00,"-0.9156,-0.9834,-0.0706,0.9018,0.7921,-0.6392,0.9506,-0.3847"
750,"Horizon against Harbor","Part campaign and part systems puzzle, Horizon against Harbor asks 1–3 players players to master Family priorities under volatile pressure. Its Family framework encourages risky pivots, especially once table politics reshape priorities. Map states remain highly legible despite scale; by late game, up to 17 tiles and layered markers support deep positional planning. Rule overhead stays modest thanks to consistent icon grammar, even while strategic depth rises sharply after the first two plays. Win or lose, Horizon against Harbor tends to produce table stories that reference specific gambits and betrayals for weeks afterward.",,Miniatures|Campaign|Legacy|Cards,Family,77.54,1,7,107,"Silver Oak Studio","Lena Ortiz",1998,/images/fixtures/game_0750.png,2026-01-20T17:53:09+00:00,2026-03-25T06:56:50+00:00,"0.8597,-0.8443,0.3625,-0.3291,0.9686,0.6769,-0.6051,-0.3645"
751,"Trailblazers: Trio","At its core, Trailblazers: Trio is a Strategy design where Campaign, Dice, Tile Laying and Solo mechanisms collide with simultaneous planning pacing for 1–3 players groups. Because scoring vectors drift over time, tables that over-specialize early often get punished once Dice effects begin stacking. Campaign logs track table history, so failed gambits still unlock content; expect up to 10 relic-style upgrades that alter scoring priorities. Few designs blend Strategy and Dice this smoothly while remaining approachable across varied player counts.",,"Campaign|Dice|Tile Laying|Solo",Strategy,56.32,1,5,50,"Arcana Works","Nico Valdez",2024,/images/fixtures/game_0751.png,2025-08-27T18:19:27+00:00,2026-03-25T06:56:50+00:00,"-0.2961,0.486,-0.7134,-0.6715,-0.7877,0.4752,-0.8348,0.4875"
752,"Sharp Labyrinth","Sharp Labyrinth opens like a classic Eurogame game, then quickly reveals Cards layers that reward long-form table memory. Its Eurogame framework encourages risky pivots, especially once table politics reshape priorities. Round structure forces meaningful tradeoffs between tempo and efficiency; over 4 chapters, even small resource leaks become strategic liabilities. Scenario goals favor adaptive teams: one mission asks for diplomatic efficiency, the next demands aggressive engine conversion under time pressure. Only adaptable crews master Sharp Labyrinth, where a hidden objective flips alliances at endgame and long-term planning matter as much as tactical brilliance.",,Cards|Miniatures,Eurogame,68.79,2,9,170,"Arcana Works","Marcus Thorne",2012,/images/fixtures/game_0752.png,2025-12-05T00:36:41+00:00,2026-03-25T06:56:50+00:00,"0.7876,0.7317,-0.7714,-0.2231,0.7494,0.873,0.727,0.9692"
753,"Inis: Arena","Designed for newcomer-friendly tables, Inis: Arena channels guild conspiracies into a ruleset that stays readable while outcomes stay unpredictable. Its Abstract framework encourages risky pivots, especially once table politics reshape priorities. Map states remain highly legible despite scale; by late game, up to 20 tiles and layered markers support deep positional planning. A standout mechanic tied to Dice means even safe plans can collapse if opponents read your tempo one round ahead. Win or lose, Inis: Arena tends to produce table stories that reference specific gambits and betrayals for weeks afterward.",,Dice|Miniatures|Cards,Abstract,69.41,3,5,104,"Arcana Works","Akira Flynn",2004,/images/fixtures/game_0753.png,2025-07-23T01:32:57+00:00,2026-03-25T06:56:50+00:00,"-0.9016,-0.4851,0.3047,0.4884,-0.6482,-0.7631,-0.6136,0.6172"
754,"Ichor Emerald","Built around Co-op systems, Ichor Emerald pushes Campaign choices across 8 linked sessions and rewards tables that enjoy mythic restoration. Your group manages attritional economies while chasing milestone bonuses; by chapter 3 the board can contain over 18 modular tiles. If your group values depth with momentum, this one delivers a rare mix of sharp tactical play and evolving campaign texture.",,"Tile Laying|Campaign",Co-op,77.23,3,6,83,"Arcana Works","Elliot Mercer",2018,/images/fixtures/game_0754.png,2026-02-12T20:59:51+00:00,2026-03-25T06:56:50+00:00,"0.8966,-0.8542,0.986,0.6868,0.1353,-0.4059,0.0186,-0.933"
755,"Clever Frontier","Clever Frontier blends Co-op structure with Dice chaos, delivering 105-minute arcs where every decision compounds into later chapters. Mission cadence alternates between tactical crunch and narrative resolution, preventing decision fatigue while preserving competitive tension. Campaign logs track table history, so failed gambits still unlock content; expect up to 7 relic-style upgrades that alter scoring priorities. Veteran groups report that Clever Frontier shines brightest after a few sessions, once subtle timing windows and bluff cues become legible.",,Dice|Campaign,Co-op,36.32,3,9,75,"Clockwork Labs","Soraya Kline",2018,/images/fixtures/game_0755.png,2025-12-15T01:05:58+00:00,2026-03-25T06:56:50+00:00,"-0.7863,-0.803,-0.4299,0.5011,-0.5785,-0.5971,0.2551,0.3098"
756,"Pedal Legacy","Designed for mid-weight hobby tables, Pedal Legacy channels mythic restoration into a ruleset that stays readable while outcomes stay unpredictable. Its Co-op framework encourages risky pivots, especially once table politics reshape priorities. Economy rails are intentionally unstable: once players trigger threshold events, 7 new scoring hooks reshape optimal lines. Negotiation matters more than it first appears; temporary coalitions routinely form, fracture, and reform inside a single chapter. Few designs blend Co-op and Tile Laying this smoothly while remaining approachable across varied player counts.",,"Tile Laying|Engine Building|Legacy",Co-op,87.09,4,5,46,"Silver Oak Studio","Nico Valdez",2006,/images/fixtures/game_0756.png,2026-02-15T03:29:41+00:00,2026-03-25T06:56:50+00:00,"0.7219,-0.7035,-0.1987,0.499,0.7056,-0.2311,0.6977,-0.0073"
757,"Vibrant Trio","Vibrant Trio blends Eurogame structure with Engine Building chaos, delivering 42-minute arcs where every decision compounds into later chapters. Map states remain highly legible despite scale; by late game, up to 24 tiles and layered markers support deep positional planning. Expect repeat plays to diverge quickly: opening lines may look familiar, but midgame states rarely resolve the same way twice.",,"Engine Building|Campaign|Tile Laying",Eurogame,82.69,4,7,68,"Clockwork Labs","Nico Valdez",2016,/images/fixtures/game_0757.png,2025-06-22T13:45:42+00:00,2026-03-25T06:56:50+00:00,"-0.5351,0.4881,0.2839,-0.2592,-0.5654,0.2484,-0.8302,0.0276"
758,"Scout: Championship","Part campaign and part systems puzzle, Scout: Championship asks 2–5 players players to master Deck Building priorities under volatile pressure. Core turns revolve around programmed actions: commit actions, resolve conflicts, then pivot as event decks introduce 7 escalating complications. Only adaptable crews master Scout: Championship, where one public objective mutates whenever milestones are missed and long-term planning matter as much as tactical brilliance.",,"Solo|Tile Laying|Campaign","Deck Building",21.57,2,8,59,"Arcana Works","Elliot Mercer",2022,/images/fixtures/game_0758.png,2025-06-29T16:16:37+00:00,2026-03-25T06:56:50+00:00,"0.1146,0.8389,0.6926,-0.0095,-0.1519,0.2896,0.0591,0.7954"
759,"Silos Mythic","Designed for newcomer-friendly tables, Silos Mythic channels expedition survival into a ruleset that stays readable while outcomes stay unpredictable. Map states remain highly legible despite scale; by late game, up to 23 tiles and layered markers support deep positional planning. The late game stays dramatic without becoming random, making each finale feel like the natural consequence of earlier risks.",,Dice|Solo,Party,28.21,2,10,175,"Nimbus Games","Lena Ortiz",2014,/images/fixtures/game_0759.png,2025-08-14T15:30:00+00:00,2026-03-25T06:56:50+00:00,"0.5168,-0.1031,0.8296,-0.8729,0.5364,0.115,-0.1303,-0.4052"
760,"Voyage under Frontier","Designed for brain-burner tables, Voyage under Frontier channels merchant drama into a ruleset that stays readable while outcomes stay unpredictable. Its Deck Building framework encourages risky pivots, especially once table politics reshape priorities. Economy rails are intentionally unstable: once players trigger threshold events, 8 new scoring hooks reshape optimal lines. A standout mechanic tied to Miniatures means even safe plans can collapse if opponents read your tempo one round ahead. Few designs blend Deck Building and Miniatures this smoothly while remaining approachable across varied player counts.",,"Tile Laying|Solo|Engine Building|Miniatures","Deck Building",58.70,4,5,52,"Silver Oak Studio","Lena Ortiz",1999,/images/fixtures/game_0760.png,2025-10-04T00:36:21+00:00,2026-03-25T06:56:50+00:00,"0.236,-0.5796,0.8308,0.913,-0.5528,0.6134,-0.211,-0.718"
761,"Ego Galactic","Ego Galactic blends Thematic structure with Campaign chaos, delivering 104-minute arcs where every decision compounds into later chapters. Campaign logs track table history, so failed gambits still unlock content; expect up to 5 relic-style upgrades that alter scoring priorities. Veteran groups report that Ego Galactic shines brightest after a few sessions, once subtle timing windows and bluff cues become legible.",,"Dice|Campaign|Tile Laying",Thematic,86.31,2,9,146,"Arcana Works","Marcus Thorne",1990,/images/fixtures/game_0761.png,2025-05-21T23:54:45+00:00,2026-03-25T06:56:50+00:00,"-0.1091,0.6475,-0.1244,-0.6735,0.8506,0.895,-0.9655,-0.7221"
762,"Luminous Odyssey","Part campaign and part systems puzzle, Luminous Odyssey asks 2–6 players players to master Eurogame priorities under scarce pressure. Campaign logs track table history, so failed gambits still unlock content; expect up to 10 relic-style upgrades that alter scoring priorities. Only adaptable crews master Luminous Odyssey, where one public objective mutates whenever milestones are missed and long-term planning matter as much as tactical brilliance.",,Legacy|Dice|Miniatures,Eurogame,72.52,4,7,130,"Nimbus Games","Marcus Thorne",2016,/images/fixtures/game_0762.png,2025-08-09T22:40:56+00:00,2026-03-25T06:56:50+00:00,"-0.3597,0.0295,-0.8615,-0.2887,-0.3861,-0.8279,0.9911,-0.2097"
763,"My City Verdant","Part campaign and part systems puzzle, My City Verdant asks 2–3 players players to master Strategy priorities under tight pressure. Core turns revolve around sequential tactical turns: commit actions, resolve conflicts, then pivot as event decks introduce 6 escalating complications. Few designs blend Strategy and Cards this smoothly while remaining approachable across varied player counts.",,Cards|Legacy|Dice,Strategy,33.87,4,7,160,"Silver Oak Studio","Marcus Thorne",2001,/images/fixtures/game_0763.png,2025-08-18T06:03:35+00:00,2026-03-25T06:56:50+00:00,"-0.7425,-0.0301,0.5766,-0.0123,0.602,0.2864,-0.2484,-0.6195"
764,"Zoo Vadis: Guild","Zoo Vadis: Guild blends Deck Building structure with Engine Building chaos, delivering 106-minute arcs where every decision compounds into later chapters. Action windows stay short, but consequence chains run long, especially in sessions around 106 minutes where adaptation beats scripted play. Win or lose, Zoo Vadis: Guild tends to produce table stories that reference specific gambits and betrayals for weeks afterward.",,"Engine Building|Cards","Deck Building",52.48,1,8,131,"Arcana Works","Soraya Kline",2007,/images/fixtures/game_0764.png,2025-11-11T12:19:28+00:00,2026-03-25T06:56:50+00:00,"-0.9421,0.4224,-0.291,0.6851,0.7887,0.8412,0.0031,-0.1194"
765,"Cooperative Forge","At its core, Cooperative Forge is a Family design where Dice and Solo mechanisms collide with real-time bursts pacing for 1–6 players groups. Scenario goals favor adaptive teams: one mission asks for diplomatic efficiency, the next demands aggressive engine conversion under time pressure. Your group manages volatile economies while chasing milestone bonuses; by chapter 6 the board can contain over 29 modular tiles. If your table likes post-game debriefs, Cooperative Forge will spark them—nearly every finale feels earned, messy, and memorable.",,Dice|Solo,Family,23.94,3,6,86,"Clockwork Labs","Soraya Kline",2004,/images/fixtures/game_0765.png,2026-02-08T02:19:03+00:00,2026-03-25T06:56:50+00:00,"0.1137,0.5338,-0.7086,0.1322,-0.9928,-0.4355,-0.8892,0.7642"
766,"El Grande Competitive","Designed for family-plus strategy tables, El Grande Competitive channels mythic restoration into a ruleset that stays readable while outcomes stay unpredictable. Its Abstract framework encourages risky pivots, especially once table politics reshape priorities. Economy rails are intentionally unstable: once players trigger threshold events, 4 new scoring hooks reshape optimal lines. Negotiation matters more than it first appears; temporary coalitions routinely form, fracture, and reform inside a single chapter. If your group values depth with momentum, this one delivers a rare mix of sharp tactical play and evolving campaign texture.",,"Engine Building|Tile Laying|Dice",Abstract,33.09,4,10,128,"Indigo Forge","Lena Ortiz",1991,/images/fixtures/game_0766.png,2026-01-22T16:41:24+00:00,2026-03-25T06:56:50+00:00,"0.2493,0.6605,0.4644,0.8425,-0.031,-0.5411,-0.163,-0.9476"
767,"Trailblazers Obsidian","Designed for brain-burner tables, Trailblazers Obsidian channels guild conspiracies into a ruleset that stays readable while outcomes stay unpredictable. Action windows stay short, but consequence chains run long, especially in sessions around 127 minutes where adaptation beats scripted play. Few designs blend Co-op and Cards this smoothly while remaining approachable across varied player counts.",,Cards|Solo,Co-op,41.04,2,10,62,"Silver Oak Studio","Nico Valdez",2016,/images/fixtures/game_0767.png,2025-12-26T00:54:48+00:00,2026-03-25T06:56:50+00:00,"-0.2909,-0.3046,0.128,-0.7098,0.1712,0.5946,0.1226,0.4159"
768,"Azul: Tigris and Euphrates","Azul: Tigris and Euphrates is a brain-burner Abstract title for 2–8 players that leans into Solo, Engine Building, Cards and Tile Laying and draft-and-resolve rounds play. Map states remain highly legible despite scale; by late game, up to 25 tiles and layered markers support deep positional planning. Veteran groups report that Azul: Tigris and Euphrates shines brightest after a few sessions, once subtle timing windows and bluff cues become legible.",,"Solo|Engine Building|Cards|Tile Laying",Abstract,43.50,2,7,48,"Arcana Works","Soraya Kline",1995,/images/fixtures/game_0768.png,2025-12-25T23:18:30+00:00,2026-03-25T06:56:50+00:00,"-0.369,0.8666,0.3693,0.533,0.4391,0.9644,-0.6865,0.6199"
